file,alt,title,caption,category,usage,tags,source
images/hero-outdoor-umbrella.webp,Sân vườn cafe phủ bóng ô dù ngoài trời trong không gian outdoor living của Ô Dù Đại Phát,Hero ô dù ngoài trời phong cách outdoor living,"Khoảnh khắc sân vườn cafe được che phủ nhẹ nhàng, tạo cảm giác nghỉ dưỡng và tiếp khách ngoài trời cao cấp.",hero,homepage hero luxury outdoor living,"hero,outdoor-living,cafe-san-vuon,villa-garden,luxury-outdoor,odudaiphat",hero-cafe (2).jpg
images/du-lech-tam-hero.webp,Dù lệch tâm vuông hợp kim nhôm bên hồ bơi villa tạo vùng nghỉ mát sang trọng,Hero dù lệch tâm cho hồ bơi villa,"Tán dù lệch tâm mở rộng không gian thư giãn bên hồ bơi, phù hợp resort, villa và khu nghỉ dưỡng riêng tư.",hero,money page hero du lech tam,"du-lech-tam,villa-pool,hop-kim-nhom,boutique-resort,hospitality-outdoor",217673333377658701 (1).jpg
images/category/du-lech-tam.webp,"Bộ sưu tập dù lệch tâm cho sân vườn villa, rooftop cafe và hồ bơi resort",Danh mục dù lệch tâm ngoài trời,"Dòng dù lệch tâm dành cho không gian cần vùng che rộng, dáng hiện đại và cảm giác outdoor lifestyle cao cấp.",category,category du lech tam,"du-lech-tam,patio-umbrella,rooftop-cafe,villa-garden,resort-pool",o-du-lech-tam-vuong-3m-hkn-de-nhua-1.webp
images/category/du-chinh-tam.webp,Dù chính tâm thân gỗ đặt giữa bàn cafe sân vườn với cảm giác mộc sang và thư giãn,Danh mục dù chính tâm thân gỗ,"Dù chính tâm tạo điểm nhấn cân đối cho patio, terrace cafe và khu vực bàn ghế ngoài trời.",category,category du chinh tam,"du-chinh-tam,than-go,terrace-cafe,patio-dining,garden-cafe",1788667080321514.webp
images/category/o-du-cafe.webp,Ô dù cafe ngoài trời hoàn thiện khu bàn ghế sân vườn theo phong cách hospitality cao cấp,Danh mục ô dù cafe ngoài trời,"Các mẫu ô dù cafe giúp không gian phục vụ ngoài trời trở nên mát, chỉn chu và dễ giữ chân khách hơn.",category,category o du cafe,"o-du-cafe,hospitality,cafe-outdoor,garden-seating,premium-patio",o-du-chinh-tam-khung-go-3m-che-nang-quan-cafe-2-1.jpg
images/category/du-san-vuon.webp,"Dù sân vườn cho góc patio villa, bàn trà ngoài trời và không gian thư giãn gia đình",Danh mục dù sân vườn villa,"Dù sân vườn tạo vùng bóng mát vừa đủ cho sân hiên, ban công rộng và khu tiếp khách ngoài trời.",category,category du san vuon,"du-san-vuon,villa-patio,outdoor-living,ban-tra,garden-lounge",650808423_122152807761112864_8382012058897569739_n (1).jpg
images/category/nha-bat-di-dong.webp,Nhà bạt di động 3x3 cho sự kiện ngoài trời cần khu che phủ gọn gàng và linh hoạt,Danh mục nhà bạt di động 3x3,"Nhà bạt xếp phù hợp gian hàng, sự kiện sân vườn và điểm phục vụ tạm thời cần che nắng mưa.",category,category nha bat di dong,"nha-bat-di-dong,3x3,outdoor-event,gian-hang,temporary-shade",vn-11134207-7r98o-lzu0jwh6yjil95.webp
images/projects/du-lech-tam-cafe-ha-noi.webp,Khu bàn cafe ngoài trời tại Hà Nội được bố trí dù lệch tâm để tạo bóng mát và cảm giác nghỉ dưỡng,Không gian cafe Hà Nội dùng dù lệch tâm,"Một góc cafe ngoài trời trở nên dễ ngồi hơn nhờ tán dù lệch tâm, phù hợp mô hình hospitality đô thị.",project,project cafe ha noi,"du-lech-tam,cafe-ha-noi,outdoor-cafe,hospitality,real-installation",650988146_2435452920259137_5536193070326174147_n (1).jpg
images/projects/du-lech-tam-resort-da-nang.webp,Không gian resort Đà Nẵng sử dụng dù lệch tâm tạo điểm nghỉ ngoài trời tinh tế,Dù lệch tâm cho resort Đà Nẵng,"Ứng dụng dù lệch tâm trong bối cảnh nghỉ dưỡng ven biển, nơi trải nghiệm bóng mát và thẩm mỹ đều quan trọng.",project,project resort da nang,"du-lech-tam,resort-da-nang,boutique-resort,coastal-living,hospitality-outdoor",217673333377658701.jpg
images/projects/du-ho-boi-phu-quoc.webp,Hồ bơi villa Phú Quốc với dù ngoài trời tạo vùng lounge nhiệt đới sang trọng,Dù ngoài trời cho hồ bơi villa Phú Quốc,Tán dù bên hồ bơi giúp hoàn thiện cảm giác tropical outdoor living cho villa và khu nghỉ dưỡng riêng tư.,project,project ho boi phu quoc,"villa-pool,phu-quoc,tropical-outdoor,resort-lounge,du-ho-boi",a29549f6-5afc-420a-8e20-3a6a5392ef33.jpg
images/products/du-lech-tam-vuong-3m-hop-kim-nhom-01.webp,Không gian sân vườn villa sử dụng dù lệch tâm vuông 3m hợp kim nhôm màu đỏ đô,Dù lệch tâm vuông 3m trong sân vườn villa,"Tán dù vuông tạo vùng che lớn cho khu bàn ghế ngoài trời, giữ cảm giác sang trọng của sân vườn villa.",products,product image du lech tam vuong 3m hop kim nhom,"du-lech-tam,3m-hop-kim-nhom,villa,resort,patio,outdoor-living,premium-umbrella",217673333377658701 (1).jpg
images/products/du-lech-tam-vuong-3m-hop-kim-nhom-02.webp,Dù lệch tâm hợp kim nhôm mở rộng vùng bóng mát cho patio cafe ngoài trời,Dù lệch tâm cho patio cafe cao cấp,"Thiết kế lệch tâm giúp bàn ghế bên dưới thoáng hơn, phù hợp cafe sân vườn và khu tiếp khách.",products,product image du lech tam vuong 3m hop kim nhom,"du-lech-tam,3m-hop-kim-nhom,villa,resort,patio,outdoor-living,premium-umbrella",217673333377658701.jpg
images/products/du-lech-tam-vuong-3m-hop-kim-nhom-03.webp,Khu hồ bơi resort dùng dù lệch tâm vuông 3m để tạo góc nghỉ mát tinh tế,Dù lệch tâm vuông 3m bên hồ bơi resort,"Mẫu dù phù hợp hồ bơi, deck ngoài trời và lounge nghỉ dưỡng cần tán che rộng.",products,product image du lech tam vuong 3m hop kim nhom,"du-lech-tam,3m-hop-kim-nhom,villa,resort,patio,outdoor-living,premium-umbrella",a29549f6-5afc-420a-8e20-3a6a5392ef33.jpg
images/products/du-lech-tam-vuong-3m-hop-kim-nhom-04.webp,Cận cảnh tán dù lệch tâm vuông trong bối cảnh terrace xanh và nội thất ngoài trời,Chi tiết tán dù lệch tâm trong không gian terrace,Góc chụp nhấn vào kết cấu tán dù và cảm giác che phủ cho khu terrace cao cấp.,products,product image du lech tam vuong 3m hop kim nhom,"du-lech-tam,3m-hop-kim-nhom,villa,resort,patio,outdoor-living,premium-umbrella",ca04cedf-ff0e-4cbd-a43b-439d14203fc5.jpg
images/products/du-lech-tam-vuong-3m-hop-kim-nhom-05.webp,Dù lệch tâm khung hợp kim nhôm đặt trong sân vườn biệt thự nhiều cây xanh,Dù lệch tâm hợp kim nhôm cho biệt thự,"Tông đỏ đô nổi bật giữa mảng xanh, phù hợp khu sân vườn cần điểm nhấn kiến trúc.",products,product image du lech tam vuong 3m hop kim nhom,"du-lech-tam,3m-hop-kim-nhom,villa,resort,patio,outdoor-living,premium-umbrella",95815d89-5c88-4cdc-932b-dd9dd2f865d2.jpg
images/products/du-lech-tam-vuong-3m-hop-kim-nhom-06.webp,Mẫu dù lệch tâm vuông 3m tạo vùng ngồi mát cho nhà hàng sân vườn,Dù lệch tâm vuông cho nhà hàng sân vườn,Tán dù rộng giúp tối ưu trải nghiệm khách ngồi lâu trong không gian phục vụ ngoài trời.,products,product image du lech tam vuong 3m hop kim nhom,"du-lech-tam,3m-hop-kim-nhom,villa,resort,patio,outdoor-living,premium-umbrella",o-du-lech-tam-vuong-3m-hkn-de-nhua-1.webp
images/products/du-lech-tam-vuong-3m-hop-kim-nhom-07.webp,Rooftop cafe bố trí dù lệch tâm vuông để cân bằng bóng mát và tầm nhìn thoáng,Dù lệch tâm cho rooftop cafe,"Giải pháp che nắng phù hợp sân thượng, ban công lớn và quán cafe có nhiều ánh sáng.",products,product image du lech tam vuong 3m hop kim nhom,"du-lech-tam,3m-hop-kim-nhom,villa,resort,patio,outdoor-living,premium-umbrella",650988146_2435452920259137_5536193070326174147_n (1).jpg
images/products/du-lech-tam-vuong-3m-hop-kim-nhom-08.webp,Dù lệch tâm vuông 3m tạo điểm nhấn hospitality cho khu bàn ngoài trời,Dù lệch tâm vuông cho khu hospitality,"Hình ảnh gợi ý cách dùng dù lệch tâm cho quán, nhà hàng và không gian đón khách.",products,product image du lech tam vuong 3m hop kim nhom,"du-lech-tam,3m-hop-kim-nhom,villa,resort,patio,outdoor-living,premium-umbrella",651367428_2679805422418891_9113700290269494620_n (1).jpg
images/products/du-lech-tam-vuong-3m-hop-kim-nhom-09.webp,Tán dù lệch tâm màu đỏ đô nổi bật trong khu patio dining ngoài trời,Dù lệch tâm màu đỏ đô cho patio dining,Sắc đỏ đô tạo cảm giác ấm và sang khi kết hợp bàn ghế kim loại ngoài trời.,products,product image du lech tam vuong 3m hop kim nhom,"du-lech-tam,3m-hop-kim-nhom,villa,resort,patio,outdoor-living,premium-umbrella",652915643_1276273408031878_6587024463112156064_n (1).jpg
images/products/du-lech-tam-vuong-3m-hop-kim-nhom-10.webp,Dù lệch tâm vuông hợp kim nhôm che phủ góc lounge sân vườn cao cấp,Dù lệch tâm cho lounge sân vườn,"Một lựa chọn phù hợp khu lounge, bàn trà và khu nghỉ ngoài trời trong khuôn viên villa.",products,product image du lech tam vuong 3m hop kim nhom,"du-lech-tam,3m-hop-kim-nhom,villa,resort,patio,outdoor-living,premium-umbrella",651769460_2679805352418898_4563875619802118227_n (1).jpg
images/products/du-lech-tam-vuong-3m-hop-kim-nhom-11.webp,Không gian outdoor showroom trưng bày dù lệch tâm vuông với kết cấu khung rõ nét,Dù lệch tâm trong showroom ngoài trời,"Ảnh giúp khách hình dung tỷ lệ tán, khung và chân đế trước khi chọn mẫu cho công trình.",products,product image du lech tam vuong 3m hop kim nhom,"du-lech-tam,3m-hop-kim-nhom,villa,resort,patio,outdoor-living,premium-umbrella",651160290_2679805395752227_3409821915252444554_n (1).jpg
images/products/du-lech-tam-vuong-3m-hop-kim-nhom-12.webp,Dù lệch tâm 3m đặt cạnh cây xanh tạo cảm giác tropical outdoor cho sân vườn,Dù lệch tâm cho sân vườn tropical,Bối cảnh cây xanh giúp tán dù hòa vào không gian nhiệt đới và sinh hoạt ngoài trời.,products,product image du lech tam vuong 3m hop kim nhom,"du-lech-tam,3m-hop-kim-nhom,villa,resort,patio,outdoor-living,premium-umbrella",652943492_122191858550786860_4175629895978295610_n (1).jpg
images/products/du-lech-tam-vuong-3m-hop-kim-nhom-13.webp,Dù lệch tâm vuông 3m dành cho khu bàn ăn ngoài trời tại villa hiện đại,Dù lệch tâm cho bàn ăn ngoài trời,"Tán dù rộng hỗ trợ khu dining ngoài trời, nơi cần bóng mát mà không vướng cột giữa bàn.",products,product image du lech tam vuong 3m hop kim nhom,"du-lech-tam,3m-hop-kim-nhom,villa,resort,patio,outdoor-living,premium-umbrella",653833010_122154236931112864_534383530369461376_n (1).jpg
images/products/du-lech-tam-vuong-3m-hop-kim-nhom-14.webp,Góc nhìn cao của dù lệch tâm vuông cho resort landscape và lối đi sân vườn,Dù lệch tâm trong cảnh quan resort,Dáng tán vuông tạo nhịp kiến trúc rõ ràng cho cảnh quan nghỉ dưỡng và sân vườn lớn.,products,product image du lech tam vuong 3m hop kim nhom,"du-lech-tam,3m-hop-kim-nhom,villa,resort,patio,outdoor-living,premium-umbrella",653790835_122155049589112864_3570337269833615304_n (1).jpg
images/products/du-lech-tam-vuong-3m-hop-kim-nhom-15.webp,Dù lệch tâm hợp kim nhôm phối cùng nền gỗ ngoài trời và khu ngồi thư giãn,Dù lệch tâm cho nền deck ngoài trời,"Hình ảnh phù hợp tham khảo cho deck gỗ, sân hiên và khu thư giãn mở.",products,product image du lech tam vuong 3m hop kim nhom,"du-lech-tam,3m-hop-kim-nhom,villa,resort,patio,outdoor-living,premium-umbrella",653934785_122191871372786860_143901030468391498_n (1).jpg
images/products/du-lech-tam-vuong-3m-hop-kim-nhom-16.webp,Mẫu dù lệch tâm vuông 3m tạo bóng mát cho cafe sân vườn phong cách boutique,Dù lệch tâm cho boutique cafe,Tán dù giúp không gian boutique cafe ngoài trời có cảm giác riêng tư và cao cấp hơn.,products,product image du lech tam vuong 3m hop kim nhom,"du-lech-tam,3m-hop-kim-nhom,villa,resort,patio,outdoor-living,premium-umbrella",654220611_122157073179112864_3392544589051920881_n (1).jpg
images/products/du-lech-tam-vuong-3m-hop-kim-nhom-17.webp,Dù lệch tâm vuông 3m trong khu sân thượng mở với ánh sáng tự nhiên,Dù lệch tâm cho sân thượng mở,"Giải pháp che phủ nhẹ cho sân thượng, nơi cần tán rộng nhưng vẫn giữ độ thoáng.",products,product image du lech tam vuong 3m hop kim nhom,"du-lech-tam,3m-hop-kim-nhom,villa,resort,patio,outdoor-living,premium-umbrella",661658762_122102897348881962_160514750465348516_n (1).jpg
images/products/du-lech-tam-vuong-3m-hop-kim-nhom-18.webp,Dù lệch tâm hợp kim nhôm cao cấp tạo trung tâm thị giác cho khu outdoor living,Dù lệch tâm cho outdoor living cao cấp,"Ảnh nhấn vào cảm giác sống ngoài trời sang trọng, phù hợp villa, resort và quán cafe sân vườn.",products,product image du lech tam vuong 3m hop kim nhom,"du-lech-tam,3m-hop-kim-nhom,villa,resort,patio,outdoor-living,premium-umbrella",1277008921657734915 (2).jpg
images/products/du-lech-tam-2m5-khung-sat-son-tinh-dien-01.webp,Dù lệch tâm 2m5 khung sắt sơn tĩnh điện cho góc cafe sân vườn nhỏ gọn,Dù lệch tâm 2m5 cho cafe sân vườn,"Kích thước 2m5 phù hợp khu bàn nhỏ, ban công rộng và quán cafe cần bố trí linh hoạt.",products,product image du lech tam 2m5 khung sat son tinh dien,"du-lech-tam,2m5,khung-sat-son-tinh-dien,cafe-san-vuon,patio,small-garden",651623524_122194397912516522_4141234896604506253_n (1).jpg
images/products/du-lech-tam-2m5-khung-sat-son-tinh-dien-02.webp,Patio gia đình dùng dù lệch tâm 2m5 để tạo vùng ngồi mát nhẹ nhàng,Dù lệch tâm 2m5 cho patio gia đình,Mẫu dù nhỏ gọn giúp sân hiên gia đình có bóng mát mà vẫn giữ không gian thoáng.,products,product image du lech tam 2m5 khung sat son tinh dien,"du-lech-tam,2m5,khung-sat-son-tinh-dien,cafe-san-vuon,patio,small-garden",650808423_122152807761112864_8382012058897569739_n (1).jpg
images/products/du-lech-tam-2m5-khung-sat-son-tinh-dien-03.webp,Dù lệch tâm khung sắt sơn tĩnh điện đặt cạnh bàn trà ngoài trời,Dù lệch tâm cho bàn trà ngoài trời,"Ảnh gợi ý cách bố trí dù cho khu trà chiều, sân vườn và góc nghỉ trong nhà phố.",products,product image du lech tam 2m5 khung sat son tinh dien,"du-lech-tam,2m5,khung-sat-son-tinh-dien,cafe-san-vuon,patio,small-garden",654688638_1368433378373553_604071968042571985_n (1).jpg
images/products/du-lech-tam-2m5-khung-sat-son-tinh-dien-04.webp,Không gian quán cafe nhỏ dùng dù lệch tâm 2m5 để che nắng khu bàn sát hiên,Dù lệch tâm 2m5 cho quán cafe nhỏ,"Tán dù hỗ trợ khu ngồi ngoài trời có diện tích vừa, dễ kết hợp bàn ghế cafe.",products,product image du lech tam 2m5 khung sat son tinh dien,"du-lech-tam,2m5,khung-sat-son-tinh-dien,cafe-san-vuon,patio,small-garden",653041023_1366940615189496_8818345299593344390_n (1).jpg
images/products/du-lech-tam-2m5-khung-sat-son-tinh-dien-05.webp,Dù lệch tâm 2m5 tạo bóng mát cho sân vườn nhà phố phong cách thư giãn,Dù lệch tâm cho sân vườn nhà phố,"Một lựa chọn vừa vặn cho khu sân nhỏ, lối đi rộng và ban công có bàn ghế ngoài trời.",products,product image du lech tam 2m5 khung sat son tinh dien,"du-lech-tam,2m5,khung-sat-son-tinh-dien,cafe-san-vuon,patio,small-garden",654442024_122156341029112864_918106184076928645_n (1).jpg
images/products/du-lech-tam-2m5-khung-sat-son-tinh-dien-06.webp,Mẫu dù lệch tâm khung sắt phù hợp khu vực phục vụ ngoài trời của nhà hàng,Dù lệch tâm khung sắt cho nhà hàng,Khung sắt sơn tĩnh điện mang lại cảm giác chắc chắn cho khu phục vụ ngoài trời.,products,product image du lech tam 2m5 khung sat son tinh dien,"du-lech-tam,2m5,khung-sat-son-tinh-dien,cafe-san-vuon,patio,small-garden",665964611_122102895458881962_7439649683283601426_n (1).jpg
images/products/du-lech-tam-2m5-khung-sat-son-tinh-dien-07.webp,Dù lệch tâm 2m5 trong góc outdoor living nhiều cây xanh,Dù lệch tâm 2m5 cho góc outdoor living,"Tông dáng gọn giúp giữ cảm giác xanh, nhẹ và thân thiện cho khu sinh hoạt ngoài trời.",products,product image du lech tam 2m5 khung sat son tinh dien,"du-lech-tam,2m5,khung-sat-son-tinh-dien,cafe-san-vuon,patio,small-garden",1277008921657734915 (1) (1).jpg
images/products/du-lech-tam-2m5-khung-sat-son-tinh-dien-08.webp,Sân hiên villa nhỏ bố trí dù lệch tâm 2m5 cạnh bộ bàn ghế thư giãn,Dù lệch tâm 2m5 cho sân hiên villa,"Kích thước cân đối với sân hiên nhỏ, tạo điểm nghỉ mát mà không chiếm quá nhiều diện tích.",products,product image du lech tam 2m5 khung sat son tinh dien,"du-lech-tam,2m5,khung-sat-son-tinh-dien,cafe-san-vuon,patio,small-garden",3359211822870341845 (2).jpg
images/products/du-lech-tam-2m5-khung-sat-son-tinh-dien-09.webp,Dù lệch tâm 2m5 che nắng khu ghế chờ ngoài trời của quán cafe,Dù lệch tâm cho khu ghế chờ cafe,"Góc che mát giúp khách chờ, trò chuyện hoặc ngồi ngắn ngoài trời dễ chịu hơn.",products,product image du lech tam 2m5 khung sat son tinh dien,"du-lech-tam,2m5,khung-sat-son-tinh-dien,cafe-san-vuon,patio,small-garden",hero-cafe (2).jpg
images/products/du-lech-tam-2m5-khung-sat-son-tinh-dien-10.webp,Cận cảnh dù lệch tâm khung sắt sơn tĩnh điện trong bối cảnh patio sáng,Chi tiết dù lệch tâm khung sắt sơn tĩnh điện,Ảnh thể hiện cảm giác hoàn thiện gọn gàng của khung và tán cho không gian patio.,products,product image du lech tam 2m5 khung sat son tinh dien,"du-lech-tam,2m5,khung-sat-son-tinh-dien,cafe-san-vuon,patio,small-garden",693380881_122292283898020866_8070268696541882895_n.jpg
images/products/du-lech-tam-2m5-khung-sat-son-tinh-dien-11.webp,Dù lệch tâm 2m5 phối cùng bàn cafe ngoài trời trong khu sân vườn xanh,Dù lệch tâm 2m5 phối bàn cafe,Thiết kế phù hợp quán cafe cần tăng số chỗ ngồi ngoài trời mà vẫn giữ thẩm mỹ.,products,product image du lech tam 2m5 khung sat son tinh dien,"du-lech-tam,2m5,khung-sat-son-tinh-dien,cafe-san-vuon,patio,small-garden",690909169_1746380049692036_4094301489076192881_n.jpg
images/products/du-lech-tam-2m5-khung-sat-son-tinh-dien-12.webp,Mẫu dù lệch tâm nhỏ gọn cho sân thượng nhà phố và ban công rộng,Dù lệch tâm cho sân thượng nhà phố,"Tán dù hỗ trợ che nắng cho sân thượng, nơi cần sản phẩm gọn và dễ bố trí.",products,product image du lech tam 2m5 khung sat son tinh dien,"du-lech-tam,2m5,khung-sat-son-tinh-dien,cafe-san-vuon,patio,small-garden",687027251_4359964537656715_1779287580856184323_n.jpg
images/products/du-lech-tam-2m5-khung-sat-son-tinh-dien-13.webp,Dù lệch tâm 2m5 tạo vùng bóng mát trong khu cafe lifestyle ngoài trời,Dù lệch tâm cho cafe lifestyle,"Hình ảnh hướng tới cảm giác thư giãn, nhẹ và dễ ứng dụng trong quán cafe sân vườn.",products,product image du lech tam 2m5 khung sat son tinh dien,"du-lech-tam,2m5,khung-sat-son-tinh-dien,cafe-san-vuon,patio,small-garden",691918212_122292289916020866_3271315944786623458_n.jpg
images/products/du-lech-tam-2m5-khung-sat-son-tinh-dien-14.webp,Không gian patio dining nhỏ dùng dù lệch tâm để giữ bàn ăn ngoài trời mát hơn,Dù lệch tâm cho patio dining nhỏ,"Mẫu dù phù hợp khu bàn ăn ngoài trời, không gian vườn nhỏ hoặc sân hiên riêng.",products,product image du lech tam 2m5 khung sat son tinh dien,"du-lech-tam,2m5,khung-sat-son-tinh-dien,cafe-san-vuon,patio,small-garden",689804750_122292283700020866_3953873227594456948_n.jpg
images/products/du-lech-tam-2m5-khung-sat-son-tinh-dien-15.webp,Dù lệch tâm khung sắt cho khu sân vườn cần giải pháp che nắng bền và gọn,Dù lệch tâm khung sắt cho sân vườn,Khung sắt sơn tĩnh điện tạo cảm giác ổn định cho nhu cầu sử dụng thường ngày.,products,product image du lech tam 2m5 khung sat son tinh dien,"du-lech-tam,2m5,khung-sat-son-tinh-dien,cafe-san-vuon,patio,small-garden",690767567_122240125856282877_5466726043979716829_n.jpg
images/products/du-lech-tam-2m5-khung-sat-son-tinh-dien-16.webp,Mẫu dù lệch tâm 2m5 bên cạnh mảng xanh tạo cảm giác boutique garden cafe,Dù lệch tâm cho boutique garden cafe,Tán dù giúp khu cafe sân vườn nhỏ có điểm nhấn tinh tế và dễ chụp ảnh.,products,product image du lech tam 2m5 khung sat son tinh dien,"du-lech-tam,2m5,khung-sat-son-tinh-dien,cafe-san-vuon,patio,small-garden",690638012_122240127266282877_713426426184877744_n.jpg
images/products/du-lech-tam-2m5-khung-sat-son-tinh-dien-17.webp,Dù lệch tâm 2m5 trong không gian nghỉ ngoài trời của gia đình,Dù lệch tâm cho không gian nghỉ gia đình,Khu ngồi trở nên mát và dễ sử dụng hơn vào buổi trưa hoặc chiều nắng.,products,product image du lech tam 2m5 khung sat son tinh dien,"du-lech-tam,2m5,khung-sat-son-tinh-dien,cafe-san-vuon,patio,small-garden",690603387_122187487670792234_1017695734668646704_n.jpg
images/products/du-lech-tam-2m5-khung-sat-son-tinh-dien-18.webp,Dù lệch tâm 2m5 phù hợp mặt bằng kinh doanh cần tối ưu từng mét vuông,Dù lệch tâm cho mặt bằng kinh doanh nhỏ,Thiết kế lệch tâm giúp giữ khu bàn ghế thoáng và tăng hiệu quả sử dụng diện tích.,products,product image du lech tam 2m5 khung sat son tinh dien,"du-lech-tam,2m5,khung-sat-son-tinh-dien,cafe-san-vuon,patio,small-garden",690808692_122292353468020866_4589985217724146020_n.jpg
images/products/du-lech-tam-2m5-khung-sat-son-tinh-dien-19.webp,Dù lệch tâm khung sắt sơn tĩnh điện trong góc sân vườn có ánh sáng tự nhiên,Dù lệch tâm trong góc sân vườn sáng,"Hình ảnh thể hiện phong cách che nắng đơn giản, gọn và dễ phối với ngoại thất.",products,product image du lech tam 2m5 khung sat son tinh dien,"du-lech-tam,2m5,khung-sat-son-tinh-dien,cafe-san-vuon,patio,small-garden",688378978_1545245067222534_2050913399740224810_n.jpg
images/products/du-lech-tam-chinh-nghieng-2m5-khung-sat-trang-01.webp,Dù lệch tâm chỉnh nghiêng 2m5 màu trắng cho sân vườn hiện đại và ban công rộng,Dù lệch tâm chỉnh nghiêng 2m5 màu trắng,Cơ chế chỉnh nghiêng giúp tán dù linh hoạt hơn khi nắng thay đổi hướng trong ngày.,products,product image du lech tam chinh nghieng 2m5 khung sat trang,"du-lech-tam,chinh-nghieng,2m5,khung-sat-trang,terrace,modern-patio",3 (1).jpg
images/products/du-lech-tam-chinh-nghieng-2m5-khung-sat-trang-02.webp,Góc patio sáng dùng dù lệch tâm chỉnh nghiêng để cân bằng bóng mát và thẩm mỹ,Dù chỉnh nghiêng cho patio sáng,"Màu trắng tạo cảm giác nhẹ, sạch và hợp với không gian ngoài trời hiện đại.",products,product image du lech tam chinh nghieng 2m5 khung sat trang,"du-lech-tam,chinh-nghieng,2m5,khung-sat-trang,terrace,modern-patio",1 (1).jpg
images/products/du-lech-tam-chinh-nghieng-2m5-khung-sat-trang-03.webp,Dù lệch tâm chỉnh nghiêng 2m5 che nắng khu bàn cafe ngoài trời,Dù chỉnh nghiêng cho bàn cafe ngoài trời,"Tán chỉnh hướng phù hợp khu bàn sát hiên, sân vườn nhỏ và quán cafe nhiều nắng.",products,product image du lech tam chinh nghieng 2m5 khung sat trang,"du-lech-tam,chinh-nghieng,2m5,khung-sat-trang,terrace,modern-patio",2 (1).jpg
images/products/du-lech-tam-chinh-nghieng-2m5-khung-sat-trang-04.webp,Sân thượng nhà phố bố trí dù lệch tâm trắng để tạo góc nghỉ thoáng,Dù lệch tâm trắng cho sân thượng,Thiết kế sáng màu giúp sân thượng nhẹ hơn về thị giác và dễ phối ngoại thất.,products,product image du lech tam chinh nghieng 2m5 khung sat trang,"du-lech-tam,chinh-nghieng,2m5,khung-sat-trang,terrace,modern-patio",690843616_122112531446957239_4915313339111222869_n.jpg
images/products/du-lech-tam-chinh-nghieng-2m5-khung-sat-trang-05.webp,Dù lệch tâm chỉnh nghiêng trong khu outdoor showroom với dáng tán thanh lịch,Dù chỉnh nghiêng trong showroom ngoài trời,Ảnh nhấn vào dáng tán và khả năng ứng dụng linh hoạt cho nhiều mặt bằng.,products,product image du lech tam chinh nghieng 2m5 khung sat trang,"du-lech-tam,chinh-nghieng,2m5,khung-sat-trang,terrace,modern-patio",688605635_2086905545557849_640747986226423681_n.jpg
images/products/du-lech-tam-chinh-nghieng-2m5-khung-sat-trang-06.webp,Mẫu dù lệch tâm trắng cho cafe sân vườn phong cách tối giản,Dù lệch tâm trắng cho cafe tối giản,"Tông trắng phù hợp quán cafe theo phong cách sạch, sáng và ít chi tiết nặng.",products,product image du lech tam chinh nghieng 2m5 khung sat trang,"du-lech-tam,chinh-nghieng,2m5,khung-sat-trang,terrace,modern-patio",687192299_938628732593861_6997654419991744789_n.jpg
