file,alt,title,caption,category,usage,tags,source
images/products/du-lech-tam-chinh-nghieng-2m5-khung-sat-trang-07.webp,Dù lệch tâm chỉnh nghiêng tạo bóng mát cho góc lounge ngoài trời,Dù chỉnh nghiêng cho lounge ngoài trời,"Tán dù hỗ trợ khu ghế thư giãn, nơi cần che nắng mà vẫn giữ cảm giác thoáng.",products,product image du lech tam chinh nghieng 2m5 khung sat trang,"du-lech-tam,chinh-nghieng,2m5,khung-sat-trang,terrace,modern-patio",687033766_122207849180786860_9146187964218283951_n.jpg
images/products/du-lech-tam-chinh-nghieng-2m5-khung-sat-trang-08.webp,Không gian terrace dùng dù lệch tâm 2m5 trắng cho bàn trà và ghế nghỉ,Dù lệch tâm trắng cho terrace,"Mẫu dù phù hợp terrace, ban công rộng và patio cần điểm nhấn nhẹ nhàng.",products,product image du lech tam chinh nghieng 2m5 khung sat trang,"du-lech-tam,chinh-nghieng,2m5,khung-sat-trang,terrace,modern-patio",691930783_122187353936792234_570189141798247429_n.jpg
images/products/du-lech-tam-chinh-nghieng-2m5-khung-sat-trang-09.webp,Dù chỉnh nghiêng 2m5 trong bối cảnh sân vườn xanh và nội thất ngoài trời,Dù chỉnh nghiêng trong sân vườn xanh,Cấu trúc chỉnh nghiêng giúp tăng khả năng che nắng trong không gian sử dụng thực tế.,products,product image du lech tam chinh nghieng 2m5 khung sat trang,"du-lech-tam,chinh-nghieng,2m5,khung-sat-trang,terrace,modern-patio",690847912_122187353948792234_985149360304800688_n.jpg
images/products/du-lech-tam-chinh-nghieng-2m5-khung-sat-trang-10.webp,Dù lệch tâm trắng đặt cạnh khu bàn cafe tạo cảm giác boutique outdoor,Dù lệch tâm trắng cho boutique outdoor,"Sắc trắng làm mềm không gian và phù hợp bối cảnh cafe, nhà hàng ngoài trời.",products,product image du lech tam chinh nghieng 2m5 khung sat trang,"du-lech-tam,chinh-nghieng,2m5,khung-sat-trang,terrace,modern-patio",687690676_122292299084020866_2214005066200029326_n.jpg
images/products/du-lech-tam-chinh-nghieng-2m5-khung-sat-trang-11.webp,Dù lệch tâm chỉnh nghiêng cho sân hiên villa nhỏ với ánh nắng dịu,Dù chỉnh nghiêng cho sân hiên villa,"Tán dù tạo vùng che linh hoạt cho sân hiên, nơi nắng thường thay đổi theo giờ.",products,product image du lech tam chinh nghieng 2m5 khung sat trang,"du-lech-tam,chinh-nghieng,2m5,khung-sat-trang,terrace,modern-patio",690605491_1545019563911751_667681896969864311_n.jpg
images/products/du-lech-tam-chinh-nghieng-2m5-khung-sat-trang-12.webp,Mẫu dù lệch tâm 2m5 khung trắng trong khu cafe có nhiều cây xanh,Dù lệch tâm 2m5 khung trắng,Dáng sáng và gọn giúp sản phẩm hòa vào mảng xanh mà không làm nặng không gian.,products,product image du lech tam chinh nghieng 2m5 khung sat trang,"du-lech-tam,chinh-nghieng,2m5,khung-sat-trang,terrace,modern-patio",690766998_1545019213911786_1855549664356889984_n.jpg
images/products/du-lech-tam-chinh-nghieng-2m5-khung-sat-trang-13.webp,Dù chỉnh nghiêng dùng cho patio dining nhỏ và khu bàn ăn ngoài trời,Dù chỉnh nghiêng cho patio dining,Khả năng điều hướng tán giúp bàn ăn ngoài trời dễ chịu hơn trong nhiều thời điểm.,products,product image du lech tam chinh nghieng 2m5 khung sat trang,"du-lech-tam,chinh-nghieng,2m5,khung-sat-trang,terrace,modern-patio",690045139_122240051444282877_1678147746142813221_n.jpg
images/products/du-lech-tam-chinh-nghieng-2m5-khung-sat-trang-14.webp,Dù lệch tâm trắng tạo vùng bóng mát sạch mắt cho khu sân vườn gia đình,Dù lệch tâm trắng cho sân vườn gia đình,Một lựa chọn nhẹ về thị giác cho không gian gia đình cần che nắng hàng ngày.,products,product image du lech tam chinh nghieng 2m5 khung sat trang,"du-lech-tam,chinh-nghieng,2m5,khung-sat-trang,terrace,modern-patio",691996972_122187413510792234_3033032934224737165_n.jpg
images/products/du-lech-tam-chinh-nghieng-2m5-khung-sat-trang-15.webp,Cận cảnh dù lệch tâm chỉnh nghiêng 2m5 với cảm giác hoàn thiện gọn gàng,Chi tiết dù lệch tâm chỉnh nghiêng,Ảnh hỗ trợ khách xem dáng tán và tỷ lệ sản phẩm trước khi chọn mẫu.,products,product image du lech tam chinh nghieng 2m5 khung sat trang,"du-lech-tam,chinh-nghieng,2m5,khung-sat-trang,terrace,modern-patio",690634579_1416120023868235_5376107130950058029_n.jpg
images/products/du-lech-tam-chinh-nghieng-2m5-khung-sat-trang-16.webp,Dù lệch tâm trắng trong khu phục vụ ngoài trời của quán cafe sân vườn,Dù lệch tâm trắng cho khu phục vụ cafe,Tán dù tạo bóng mát cho khu phục vụ mà vẫn giữ vẻ sáng và hiện đại.,products,product image du lech tam chinh nghieng 2m5 khung sat trang,"du-lech-tam,chinh-nghieng,2m5,khung-sat-trang,terrace,modern-patio",653899881_122191872332786860_2185450838062226167_n (2).jpg
images/products/du-lech-tam-chinh-nghieng-2m5-khung-sat-trang-17.webp,Dù chỉnh nghiêng 2m5 cho không gian nghỉ ngoài trời theo phong cách villa nhỏ,Dù chỉnh nghiêng cho villa nhỏ,"Kích thước 2m5 vừa đủ cho khu ngồi riêng tư, sân hiên và bàn trà ngoài trời.",products,product image du lech tam chinh nghieng 2m5 khung sat trang,"du-lech-tam,chinh-nghieng,2m5,khung-sat-trang,terrace,modern-patio",655147942_122155912023112864_8158879660458557845_n (1).jpg
images/products/du-lech-tam-chinh-nghieng-2m5-khung-sat-trang-18.webp,Dù lệch tâm màu trắng nổi bật trong bối cảnh rooftop lounge thanh lịch,Dù lệch tâm trắng cho rooftop lounge,"Tông trắng hợp với rooftop lounge, giúp không gian ngoài trời giữ cảm giác thoáng và cao cấp.",products,product image du lech tam chinh nghieng 2m5 khung sat trang,"du-lech-tam,chinh-nghieng,2m5,khung-sat-trang,terrace,modern-patio",651829029_1371793498300888_6520485467509915161_n (2).jpg
images/products/du-lech-tam-chinh-nghieng-2m5-khung-sat-trang-19.webp,Dù lệch tâm chỉnh nghiêng giúp khu patio nhiều nắng trở nên dễ sử dụng hơn,Dù chỉnh nghiêng cho patio nhiều nắng,"Tán điều chỉnh hướng nắng là lợi thế cho patio, terrace và ban công mở.",products,product image du lech tam chinh nghieng 2m5 khung sat trang,"du-lech-tam,chinh-nghieng,2m5,khung-sat-trang,terrace,modern-patio",653806867_122278626140060752_2609913405897498126_n (1).jpg
images/products/du-chinh-tam-tron-3m-than-go-day-rut-01.webp,Dù chính tâm tròn thân gỗ đặt giữa sân vườn cafe với cảm giác mộc sang,Dù chính tâm thân gỗ cho cafe sân vườn,Trụ gỗ và tán tròn tạo điểm nhấn ấm áp cho bàn cafe ngoài trời.,products,product image du chinh tam tron 3m than go day rut,"du-chinh-tam,than-go,3m,garden-cafe,patio-dining,resort-garden",1788667080321514.webp
images/products/du-chinh-tam-tron-3m-than-go-day-rut-02.webp,Bàn trà sân vườn sử dụng dù chính tâm 3m để tạo vùng ngồi cân đối,Dù chính tâm 3m cho bàn trà sân vườn,"Thiết kế chính tâm phù hợp khu bàn tròn, patio và góc tiếp khách ngoài trời.",products,product image du chinh tam tron 3m than go day rut,"du-chinh-tam,than-go,3m,garden-cafe,patio-dining,resort-garden",o-chinh-tam-tron-khung-go.jpeg
images/products/du-chinh-tam-tron-3m-than-go-day-rut-03.webp,Dù chính tâm thân gỗ trong không gian resort garden nhiều cây xanh,Dù chính tâm thân gỗ cho resort garden,Cảm giác mộc tự nhiên giúp sản phẩm hòa với cảnh quan xanh và không gian nghỉ dưỡng.,products,product image du chinh tam tron 3m than go day rut,"du-chinh-tam,than-go,3m,garden-cafe,patio-dining,resort-garden",xuong-sam-xuat-o-du-khung-go-3m.jpg
images/products/du-chinh-tam-tron-3m-than-go-day-rut-04.webp,Không gian cafe terrace dùng dù chính tâm tròn để tạo bóng mát gọn gàng,Dù chính tâm tròn cho cafe terrace,"Tán tròn giúp khu bàn cafe có vùng che đều, phù hợp mặt bằng nhỏ và vừa.",products,product image du chinh tam tron 3m than go day rut,"du-chinh-tam,than-go,3m,garden-cafe,patio-dining,resort-garden",oduvansy-othango-jpeg.webp
images/products/du-chinh-tam-tron-3m-than-go-day-rut-05.webp,Dù chính tâm tròn thân gỗ cho patio nhà hàng và sân vườn biệt thự,Dù chính tâm gỗ cho patio nhà hàng,"Mẫu dù tạo cảm giác chỉn chu cho khu bàn ngoài trời của nhà hàng, villa và sân vườn.",products,product image du chinh tam tron 3m than go day rut,"du-chinh-tam,than-go,3m,garden-cafe,patio-dining,resort-garden",2bc4fbbee77f5b21026e.jpg
images/products/du-chinh-tam-tron-3m-than-go-day-rut-06.webp,Dù chính tâm 3m dây rút trong khu cafe sân vườn ấm và gần gũi,Dù chính tâm dây rút cho cafe sân vườn,Cơ chế dây rút và chất liệu gỗ mang lại cảm giác truyền thống nhưng vẫn sang.,products,product image du chinh tam tron 3m than go day rut,"du-chinh-tam,than-go,3m,garden-cafe,patio-dining,resort-garden",1788685834377036.webp
images/products/du-chinh-tam-tron-3m-than-go-day-rut-07.webp,Dù chính tâm thân gỗ phối cùng bàn ghế outdoor trong không gian hospitality,Dù chính tâm gỗ cho hospitality outdoor,Ảnh gợi ý cách phối dù chính tâm với bộ bàn ghế phục vụ ngoài trời.,products,product image du chinh tam tron 3m than go day rut,"du-chinh-tam,than-go,3m,garden-cafe,patio-dining,resort-garden",o-du-chinh-tam-khung-go-3m-che-nang-quan-cafe-2-1.jpg
images/products/du-chinh-tam-tron-3m-than-go-day-rut-08.webp,Dù chính tâm tròn 3m che nắng khu sân hiên và quán cafe ngoài trời,Dù chính tâm tròn cho sân hiên cafe,"Tán tròn cân đối với bàn ghế, phù hợp khu vực tiếp khách có diện tích vừa.",products,product image du chinh tam tron 3m than go day rut,"du-chinh-tam,than-go,3m,garden-cafe,patio-dining,resort-garden",ly-do-ban-nen-mua-o-du-chinh-tam-khung-go-3m-che-nang-quan-cafe-tai-xuong-san-xuat-o-du-chinh-tam.jpg
images/products/du-chinh-tam-tron-3m-than-go-day-rut-09.webp,Mẫu dù chính tâm gỗ cho quán cafe cần phong cách tự nhiên và cao cấp,Dù chính tâm gỗ cho cafe tự nhiên,"Chất liệu gỗ tạo cảm giác ấm, hợp với quán cafe sân vườn và decor mộc.",products,product image du chinh tam tron 3m than go day rut,"du-chinh-tam,than-go,3m,garden-cafe,patio-dining,resort-garden",sg-11134201-22120-lfkvis4g9glvab.jpg
images/products/du-chinh-tam-tron-3m-than-go-day-rut-10.webp,Dù chính tâm tròn thân gỗ tạo bóng mát cho khu bàn trà ngoài trời,Dù chính tâm cho bàn trà ngoài trời,"Hình ảnh phù hợp sân vườn gia đình, villa nhỏ và khu thư giãn riêng.",products,product image du chinh tam tron 3m than go day rut,"du-chinh-tam,than-go,3m,garden-cafe,patio-dining,resort-garden",du-che7.jpg
images/products/du-chinh-tam-tron-3m-than-go-day-rut-11.webp,Dù chính tâm 3m trong lối đi resort sân vườn và không gian xanh,Dù chính tâm trong cảnh quan resort,Tán tròn giúp tạo nhịp bóng mát nhẹ nhàng trong cảnh quan nghỉ dưỡng.,products,product image du chinh tam tron 3m than go day rut,"du-chinh-tam,than-go,3m,garden-cafe,patio-dining,resort-garden",981236189231.png
images/products/du-chinh-tam-tron-3m-than-go-day-rut-12.webp,Dù chính tâm thân gỗ dây rút cho khu vực phục vụ cafe ngoài trời,Dù chính tâm gỗ cho khu phục vụ cafe,Một lựa chọn dễ bố trí cho quán cafe cần nhiều bàn ghế có bóng mát riêng.,products,product image du chinh tam tron 3m than go day rut,"du-chinh-tam,than-go,3m,garden-cafe,patio-dining,resort-garden",du-quan-cafe-tron-3m.jpg
images/products/du-chinh-tam-tron-3m-than-go-day-rut-13.webp,Dù chính tâm tròn 3m tạo cảm giác thư giãn trong sân vườn villa,Dù chính tâm cho sân vườn villa,Tán dù tròn cân bằng với bàn ghế và cây xanh trong không gian sống ngoài trời.,products,product image du chinh tam tron 3m than go day rut,"du-chinh-tam,than-go,3m,garden-cafe,patio-dining,resort-garden",1648545817_o-du-chinh-tam-go-trang-kem-3 (1).jpg
images/products/du-chinh-tam-tron-3m-than-go-day-rut-14.webp,"Dù chính tâm gỗ bên hồ bơi nhỏ, sân vườn và boutique resort",Dù chính tâm gỗ cho hồ bơi nhỏ,"Dáng tán tròn phù hợp hồ bơi nhỏ, sân vườn nghỉ dưỡng và không gian boutique.",products,product image du chinh tam tron 3m than go day rut,"du-chinh-tam,than-go,3m,garden-cafe,patio-dining,resort-garden",o-du-quan-cafe-chinh-tam-go-4m-cao-cap-2.jpg
images/products/du-chinh-tam-tron-3m-than-go-day-rut-15.webp,"Dù chính tâm tròn dùng cho bàn cafe, patio và terrace ngoài trời",Dù chính tâm cho patio và terrace,"Thiết kế quen thuộc, dễ phối với nhiều kiểu bàn ghế và mặt bằng ngoài trời.",products,product image du chinh tam tron 3m than go day rut,"du-chinh-tam,than-go,3m,garden-cafe,patio-dining,resort-garden",476229352_926152372834890_6684208417644839367_n.jpg
images/products/du-chinh-tam-tron-3m-than-go-day-rut-16.webp,Dù chính tâm thân gỗ trong showroom outdoor furniture cao cấp,Dù chính tâm gỗ trong showroom outdoor,Ảnh thể hiện cảm giác sản phẩm khi đặt cùng nhóm nội thất ngoài trời cao cấp.,products,product image du chinh tam tron 3m than go day rut,"du-chinh-tam,than-go,3m,garden-cafe,patio-dining,resort-garden",476441625_926152389501555_3920264117008288017_n.jpg
images/products/nha-bat-di-dong-3x3-01.webp,Nhà bạt di động 3x3 tạo khu che phủ gọn gàng cho gian hàng sự kiện ngoài trời,Nhà bạt di động 3x3 cho sự kiện,"Giải pháp che nắng mưa linh hoạt cho gian hàng, hội chợ và khu phục vụ tạm thời.",products,product image nha bat di dong 3x3,"nha-bat-di-dong,3x3,outdoor-event,trade-booth,temporary-shade",vn-11134207-7r98o-lzu0jwh6yjil95.webp
images/products/nha-bat-di-dong-3x3-02.webp,Nhà bạt xếp 3m dùng cho activation thương mại và điểm bán lưu động,Nhà bạt xếp 3m cho activation,Kết cấu xếp gọn hỗ trợ triển khai nhanh trong các hoạt động ngoài trời.,products,product image nha bat di dong 3x3,"nha-bat-di-dong,3x3,outdoor-event,trade-booth,temporary-shade",vn-11134207-7r98o-lzu0jwgx4ko1ce.webp
images/products/nha-bat-di-dong-3x3-03.webp,Mẫu nhà bạt di động 3x3 cho sự kiện sân vườn và khu phục vụ tạm thời,Nhà bạt 3x3 cho sự kiện sân vườn,"Phù hợp khu phục vụ đồ uống, gian hàng nhỏ và điểm che nắng tạm thời.",products,product image nha bat di dong 3x3,"nha-bat-di-dong,3x3,outdoor-event,trade-booth,temporary-shade",vn-11134207-7r98o-lzu0jwgx363l9d.webp
images/products/nha-bat-di-dong-3x3-04.webp,Nhà bạt 3x3 bố trí cho gian hàng cafe và không gian outdoor thương mại,Nhà bạt 3x3 cho gian hàng cafe,Khung bạt tạo vùng che rõ ràng cho khu bán hàng ngoài trời hoặc sự kiện ngắn ngày.,products,product image nha bat di dong 3x3,"nha-bat-di-dong,3x3,outdoor-event,trade-booth,temporary-shade",vn-11134207-7r98o-lzu0jwgx1r9p37 (1).webp
images/products/nha-bat-di-dong-3x3-05.webp,Nhà bạt di động che mưa nắng cho điểm bán hàng ngoài trời cần triển khai nhanh,Nhà bạt di động cho điểm bán ngoài trời,"Mẫu bạt phù hợp nhu cầu che phủ linh hoạt, không cố định và dễ di chuyển.",products,product image nha bat di dong 3x3,"nha-bat-di-dong,3x3,outdoor-event,trade-booth,temporary-shade",vn-11134207-7r98o-lzu0jwgx5yz10a.webp
images/products/nha-bat-di-dong-3x3-06.webp,Nhà bạt xếp 3x3 cho khu trưng bày ngoài trời và sự kiện thương mại,Nhà bạt xếp cho khu trưng bày ngoài trời,Không gian trưng bày tạm thời trở nên gọn gàng và chuyên nghiệp hơn với nhà bạt 3x3.,products,product image nha bat di dong 3x3,"nha-bat-di-dong,3x3,outdoor-event,trade-booth,temporary-shade",vn-11134207-7r98o-lzu0jwgx1r9p37.webp
